first_name,itin,family,house,words,title,gender,date_birth,faith,god_to_pray,postalcode,street,number,birth_culture,country_of_birth,city_of_birth,current_culture,currency_city,rent_income_value,description_chosen_income_method,total_account_value,current_account_total_value,total_amount_carried_over,bank,account_type,investor_profile,account_status,bban_count,aba,total_limit_value,limit_value_available,total_limit_used,description_card,security_card,expire_card_number,status_account_blocked,transaction_code,date_transaction,time_transaction,describle_transaction,original_transaction_amount,number_installments_assign,current_installment,currency,yearmonthday
Donna Middleton,605-18-2033,Middleton,Middleton,Seven itself involve available some marriage artist body then soon.,Dr. Donna of house Middleton,Female,1970-09-28,OTHER,WEEPING LADY OF LYS,36859,Atkins Grove,09590,iron men,Westeros,Hesh,Braavosi,Cities of the Bloodless Men,-486123.0,-7398.0,9200957.0,8245859.0,955098.0,Braavos,salary bill,Risky,activated,OXQN86406799807673,013266223,380273.0,301229.0,79044.0,JCB 16 digit,115,04/25,activated,KWYT88557514479062,2021-11-26,06:05:13,fishing vessel,861929.0,1,0,CNY of Braavos,20211122
Pamela Savage,069-43-9826,Savage,Savage,Pattern power them administration offer crime floor amount before energy.,Mr. Pamela of house Savage,Female,1991-04-22,GARDENS OF GELENEI,AQUAN THE RED BULL,92280,Smith Run,477,Unknown,Sothoryos,White Harbor‎,Braavosi,Kosrak,+56837.0,-223509.0,715117.0,-174152.0,889269.0,Braavos,savings account,Temporary,activated,OJYW93964661744862,077213247,301615.0,211815.0,89800.0,VISA 16 digit,963,02/27,activated,LIDU13015327699643,2021-11-27,20:47:32,horn of Joramun,941589.0,3,2,TWD of Braavos,20211120
Patrick Burke,766-62-0483,Burke,Burke,Remember deal agency truth.,Dr. Patrick of house Burke,Male,2018-11-19,DOTHRAKI RELIGION,MERLING KING,05121,Denise Corners,95682,Uninformed,Westeros,Ebonhead,Uninformed,Myr‎,+170067.0,-312544.0,3265516.0,2580997.0,684519.0,Braavos,salary bill,Reliable,activated,UQXB72110664981240,098465050,849070.0,840266.0,8804.0,VISA 19 digit,857,06/23,not activated,MYZZ00835611460440,2021-11-06,00:38:06,savage army,618185.0,5,4,ISK of Braavos,20211112
Kimberly Ryan,542-02-4735,Ryan,Ryan,Democrat speak know team indicate possible list respond.,Dr. Kimberly of house Ryan,Female,1925-02-06,FAITH OF THE SEVEN,BAKKALON,76758,Michael Flat,891,Roinar,Essos,Oldtown,Free Folk,Leng Yi,-738139.0,+22726.0,7965492.0,6985431.0,980061.0,Braavos,checking account,Reliable,activated,KTAG11492507466670,093301094,473996.0,422710.0,51286.0,JCB 16 digit,980,06/24,activated,UCJX17524513522049,2021-11-27,04:48:40,swords,143409.0,2,1,PAB of Braavos,20211123
Katherine Smith,281-95-5956,Smith,Smith,Where bill political side throughout picture some goal.,Mr. Katherine of house Smith,Female,1942-11-02,OTHER,MOON,86441,Gross Lodge,42932,Valyrian,Essos,Gulltown,Braavosi,Qarth‎,-38276.0,-959144.0,8418153.0,7932543.0,485610.0,Braavos,account for the long winter,Vicious,activated,WWSL38185711694786,036507481,308949.0,267822.0,41127.0,JCB 15 digit,721,09/24,not activated,PDJF19753336225757,2021-11-30,20:42:51,ships,246987.0,6,5,MDL of Braavos,20211112
